backdrop_path,poster_path,genre_ids,keyword_ids,id,title,overview,popularity,release_date,vote_average,vote_count,genres,keywords,original_language,soup
/b2HJgNFTyqhd2BKmgWImG6r7mGy.jpg,/p1GFsUK5nCVHYNtjRxoGyfGdD9C.jpg,"[80, 18]","[378, 1499]",67166,El marginal,An ex-cop entered a prison as convicted under a false identity in order to infiltrate within a group of prisoners that has just kidnapped the teenage daughter of an important national judge.,46.482,2016-06-02,8.1,363,"['crime', 'drama']","['prison', 'pastor']",es,El marginal crime drama An ex-cop entered a prison as convicted under a false identity in order to infiltrate within a group of prisoners that has just kidnapped the teenage daughter of an important national judge. prison pastor
/qSNH7cgB0WpeQFHJGvwhyQaab9t.jpg,/cqGupIDrTHosdGTm5N0V4qMrZyf.jpg,[18],"[3036, 11001, 11162]",43899,The Bible,The story of God's creation of the Earth and the landmark events leading up to the Crucifixion of Jesus Christ.,46.102,2013-03-03,7.4,898,['drama'],"['bible', 'religion', 'miniseries']",en,The Bible drama The story of God's creation of the Earth and the landmark events leading up to the Crucifixion of Jesus Christ. bible religion miniseries
,/jXwh3fiziAYXZcWlupqQW9IVu7K.jpg,"[16, 18]",[3036],35813,Testament: The Bible in Animation,,45.956,1996-12-11,7.5,2,"['animation', 'drama']",['bible'],en,Testament: The Bible in Animation animation drama  bible
/4TpDp2hueKimqgC8hXweZW0T0yW.jpg,/aym2pCRFGY2zHNQV3DedyFsd6hq.jpg,"[10765, 18]","[2964, 481, 530, 6150, 1475, 526, 1965, 3074, 6074, 10158, 11162, 14530, 158144, 161176]",19566,Frank Herbert's Dune,Frank Herbert's Dune is a three-part miniseries written and directed by John Harrison and based on Frank Herbert's 1965 novel Dune.,43.73,2000-12-03,6.9,274,"['sci-fi & fantasy', 'drama']","['future', 'imperator', 'prophecy', 'faith', 'telepathy', 'rebel', 'sandstorm', 'insurgence', 'spice', 'alien planet', 'miniseries', 'director', 'giant worm', 'space opera']",en,Frank Herbert's Dune sci-fi & fantasy drama Frank Herbert's Dune is a three-part miniseries written and directed by John Harrison and based on Frank Herbert's 1965 novel Dune. future imperator prophecy faith telepathy rebel sandstorm insurgence spice alien planet miniseries director giant worm space opera
/AqHoDlyWRB0tW6ldYDWqvJKC6g2.jpg,/gHDKbQ6l4OdgQ9W5OxaA9RP9YMO.jpg,[18],"[3036, 4833, 156282, 160326, 188277]",7343,Kings,"A riveting drama about a modern day monarchy, a contemporary re-telling of the timeless tale of David and Goliath. This series is an epic story of greed and power, war and romance, forbidden loves and secret alliances -- and a young hero who rises to power in a modern-day kingdom.",42.067,2009-03-15,7.7,51,['drama'],"['bible', 'royal family', 'alternate reality', 'family power struggle', 'power struggle']",en,"Kings drama A riveting drama about a modern day monarchy, a contemporary re-telling of the timeless tale of David and Goliath. This series is an epic story of greed and power, war and romance, forbidden loves and secret alliances -- and a young hero who rises to power in a modern-day kingdom. bible royal family alternate reality family power struggle power struggle"
/1VlRR3whAMNPezIKDj48kWJmTRU.jpg,/diXtQic9EzM3HRpvA0PfL32kkJ0.jpg,[18],"[1160, 290, 3036, 9649]",65166,José do Egito,,41.924,2013-01-30,8.2,15,['drama'],"['egypt', 'angel', 'bible', 'god']",pt,José do Egito drama  egypt angel bible god
/wEfAUz1pAzZ4ufhT4cukMwsK8E2.jpg,/2PxnIIu9UkVAFUkFBeuwDW4DdVH.jpg,[18],"[6150, 186, 1803, 3065, 3298, 6782, 7464, 7942, 10093, 11001, 14765, 18035, 33457, 158718, 164296]",2856,The Book of Daniel,"Rev. Daniel Webster, an unconventional Episcopalian priest who not only believes in Jesus, but actually sees him and discusses life with him, is challenged on many levels as he struggles to be a good husband, father and minister, while navigating an often rocky relationship with the church hierarchy.",35.982,2006-01-06,7.2,10,['drama'],"['faith', 'christianity', 'drug addiction', 'minister', 'hallucination', 'addiction', 'alcoholism', 'imaginary friend', 'priest', 'religion', 'church', 'family', 'alcoholic', 'lgbt', 'addict']",en,"The Book of Daniel drama Rev. Daniel Webster, an unconventional Episcopalian priest who not only believes in Jesus, but actually sees him and discusses life with him, is challenged on many levels as he struggles to be a good husband, father and minister, while navigating an often rocky relationship with the church hierarchy. faith christianity drug addiction minister hallucination addiction alcoholism imaginary friend priest religion church family alcoholic lgbt addict"
/5qnO59vJwrfUJGikGQlcFbR9ZtM.jpg,/k3C8qVakO3T2WI6rLtJ1MYL9owI.jpg,[18],"[488, 3036, 11001, 11162, 157894]",17842,In the Beginning,"In the Beginning is a 2-part biblical television miniseries directed by Kevin Connor. It stars Martin Landau and Jacqueline Bisset and it premiered on NBC on November 12, 2000.",35.335,2000-11-12,7.2,5,['drama'],"['moses', 'bible', 'religion', 'miniseries', 'ancient egypt']",en,"In the Beginning drama In the Beginning is a 2-part biblical television miniseries directed by Kevin Connor. It stars Martin Landau and Jacqueline Bisset and it premiered on NBC on November 12, 2000. moses bible religion miniseries ancient egypt"
/5dQh0KIUMOEp6zSgGevqpSusfka.jpg,/hSttE4mnZdmANv6snbK2RYncbbs.jpg,"[10759, 18]","[6917, 3036]",61689,The Red Tent,"Her name is Dinah. In the Bible her life is only hinted at during a brief and violent detour within the more familiar chapters about her father, Jacob, and his dozen sons in the Book of Genesis. Told through Dinah's eloquent voice, this sweeping miniseries reveals the traditions and turmoil of ancient womanhood. Dinah's tale begins with the story of her mothers: Leah, Rachel, Zilpah, and Bilhah, the four wives of Jacob. They love Dinah and give her gifts that are to sustain her through a hard-working youth, a calling to midwifery, and a new home in a foreign land. Dinah tells us of the world of the red tent, the place where women were sequestered during their cycles of birthing, menses, and illness; of her initiations into the religious and sexual practices of her tribe; of Jacob's courtship with his four wives; of the mystery and wonder of caravans, farmers, shepherds, and slaves; of love and death in the city of Shechem; of her half-brother Joseph's rise in Egypt, and of course her marriage to Shechem and it's bloody consequences.",34.805,2014-12-07,7.1,41,"['action & adventure', 'drama']","['epic', 'bible']",en,"The Red Tent action & adventure drama Her name is Dinah. In the Bible her life is only hinted at during a brief and violent detour within the more familiar chapters about her father, Jacob, and his dozen sons in the Book of Genesis. Told through Dinah's eloquent voice, this sweeping miniseries reveals the traditions and turmoil of ancient womanhood. Dinah's tale begins with the story of her mothers: Leah, Rachel, Zilpah, and Bilhah, the four wives of Jacob. They love Dinah and give her gifts that are to sustain her through a hard-working youth, a calling to midwifery, and a new home in a foreign land. Dinah tells us of the world of the red tent, the place where women were sequestered during their cycles of birthing, menses, and illness; of her initiations into the religious and sexual practices of her tribe; of Jacob's courtship with his four wives; of the mystery and wonder of caravans, farmers, shepherds, and slaves; of love and death in the city of Shechem; of her half-brother Joseph's rise in Egypt, and of course her marriage to Shechem and it's bloody consequences. epic bible"
/9Z1aHf2hURZqzCyqMr24kSzgaVo.jpg,/5uxUa1gF15oVTyVwaKPzIBWCamM.jpg,[99],"[818, 6078, 11162, 155876, 221192, 258703, 288793]",91505,The Family,"An enigmatic conservative Christian group known as the Family wields enormous influence in Washington, D.C., in pursuit of its global ambitions.",34.753,2019-08-09,6.8,73,['documentary'],"['based on novel or book', 'politics', 'miniseries', 'reenactment', 'secrecy', 'christian', 'power']",en,"The Family documentary An enigmatic conservative Christian group known as the Family wields enormous influence in Washington, D.C., in pursuit of its global ambitions. based on novel or book politics miniseries reenactment secrecy christian power"
/yWY9senDDTOyNmaOljIF1xKIRVY.jpg,/hwVJnaxrC6GPLISLrcLEICurKH9.jpg,"[9648, 80, 9648]","[586, 6152, 8685, 14765, 161914, 222802, 269233]",349,Point Pleasant,"A series of supernatural events begins in a small coastal New Jersey town after the arrival of a mysterious teenage girl, who apparently has the ability to influence the people and events around her.",33.055,2005-01-19,6.8,33,"['mystery', 'crime', 'mystery']","['new jersey', 'supernatural', 'anti-christ', 'church', 'dark heroine', 'amnesiac', 'good versus evil']",en,"Point Pleasant mystery crime mystery A series of supernatural events begins in a small coastal New Jersey town after the arrival of a mysterious teenage girl, who apparently has the ability to influence the people and events around her. new jersey supernatural anti-christ church dark heroine amnesiac good versus evil"
/6T2ktkcqCKDPpCJB4nZeBtwns8S.jpg,/oZw9pMEHNtBzXMkWtsmnTEnrrVv.jpg,[18],"[488, 3036, 11162]",9199,The Ten Commandments,"One biblical figure is revered by Jews, Christians, and Muslims alike. His name is Moses, the man who rose in power to defend a people, to free them, and to live in history like no other... The Ten Commandments dramatizes the biblical story of Moses.",32.614,2006-04-10,5.0,14,['drama'],"['moses', 'bible', 'miniseries']",en,"The Ten Commandments drama One biblical figure is revered by Jews, Christians, and Muslims alike. His name is Moses, the man who rose in power to defend a people, to free them, and to live in history like no other... The Ten Commandments dramatizes the biblical story of Moses. moses bible miniseries"
/oKHOMudHakxD5E9u9BXs59jZQfe.jpg,/g7K7IrHzfCMbvJDahkymKugyfuZ.jpg,[35],"[6054, 212, 186, 193171, 204970, 206298]",64339,Chewing Gum,"The life of Tracey, a religious, Beyoncé-obsessed 22-year-old  living in an estate in Tower Hamlets, and the mishaps of her neighbourhood, friends and family. Oh, and obvs her boyfriend!",28.334,2015-10-06,7.3,79,['comedy'],"['friendship', 'london, england', 'christianity', 'sitcom', 'east end of london', 'young adult']",en,"Chewing Gum comedy The life of Tracey, a religious, Beyoncé-obsessed 22-year-old  living in an estate in Tower Hamlets, and the mishaps of her neighbourhood, friends and family. Oh, and obvs her boyfriend! friendship london, england christianity sitcom east end of london young adult"
,/9d5d3Dl5kDhxHlmMw2xbqZKOJpc.jpg,[18],"[3033, 3036, 11162, 281102]",16062,A.D.,A 12 hours miniseries adapted from Anthony Burgess's novel The Kingdom of the Wicked.,28.312,1985-03-31,4.7,7,['drama'],"['apostle', 'bible', 'miniseries', 'a.d. anno domini']",en,A.D. drama A 12 hours miniseries adapted from Anthony Burgess's novel The Kingdom of the Wicked. apostle bible miniseries a.d. anno domini
/czvfBZ8zLQZum2ZQOjbuhmCXKIf.jpg,/h5pSXFYmpQiTaq9ECKKMm7xjU3t.jpg,[18],"[3036, 11001, 210015]",65814,Of Kings and Prophets,"An epic biblical saga of faith, ambition and betrayal as told through the eyes of the battle-weary King Saul, the resentful prophet Samuel and the resourceful young shepherd David—all on a collision course with destiny that will change the world. One thousand years before Christ, the first king of the Israelites, Saul, struggles to unify the 12 Israelite tribes and defend his fledgling nation against savage enemy attacks. The prophet Samuel relays a message from God to King Saul that he must destroy one of Israel's ancient enemies. But when Saul defies that message, Samuel prophesies that the Lord will tear the kingdom of Israel from him and choose another in his place. In time, Saul comes to realize that his greatest threat will not come from his enemies, but from the shepherd, David.",28.291,2016-03-08,6.3,18,['drama'],"['bible', 'religion', 'ancient israel']",en,"Of Kings and Prophets drama An epic biblical saga of faith, ambition and betrayal as told through the eyes of the battle-weary King Saul, the resentful prophet Samuel and the resourceful young shepherd David—all on a collision course with destiny that will change the world. One thousand years before Christ, the first king of the Israelites, Saul, struggles to unify the 12 Israelite tribes and defend his fledgling nation against savage enemy attacks. The prophet Samuel relays a message from God to King Saul that he must destroy one of Israel's ancient enemies. But when Saul defies that message, Samuel prophesies that the Lord will tear the kingdom of Israel from him and choose another in his place. In time, Saul comes to realize that his greatest threat will not come from his enemies, but from the shepherd, David. bible religion ancient israel"
/khxPVWZL0Lbd1JZJ7z5vKjoCOqH.jpg,/7EdevpTHAoizlEHVATfvgurFsaY.jpg,[18],"[818, 745, 10483, 10093, 18396, 156630, 157008, 208719]",91413,Lambs of God,"A dark, gothic tale about three nuns, each a generation apart, living in an isolated convent by the coast, and an unwelcome visitor who enters their lives and changes their world forever.",28.059,2019-07-21,6.2,29,['drama'],"['based on novel or book', 'nun', 'eccentric', 'priest', 'catholic', 'remote island', 'catholic church', 'secluded']",en,"Lambs of God drama A dark, gothic tale about three nuns, each a generation apart, living in an isolated convent by the coast, and an unwelcome visitor who enters their lives and changes their world forever. based on novel or book nun eccentric priest catholic remote island catholic church secluded"
/1xU9V4xdCRZQdoAwKy0LlfBdtNU.jpg,/MqDwyYfPhEeVgV8a0KXi9baMQh.jpg,[18],"[3571, 3036, 11001, 11162, 230097, 243261, 258703, 273060, 282071, 282633, 291162]",62287,A.D. The Bible Continues,"""A.D. The Bible Continues"" picks up where the smash hit miniseries ""The Bible"" left off, continuing the greatest story ever told and exploring the exciting and inspiring events that followed the Crucifixion of Christ. The immediate aftermath of Christ's death had a massive impact on his disciples, his mother, Mary, and key political and religious leaders of the era, completely altering the entire world in an instant. Beginning at that fateful moment of the Crucifixion and the Resurrection, ""A.D. The Bible Continues"" will focus on the disciples who had to go forward and spread the teachings of Christ to a world dominated by political unrest, and the start of a whole new religion that would dramatically reshape the history of the world.",26.035,2015-04-05,6.4,31,['drama'],"['crucifixion', 'bible', 'religion', 'miniseries', 'jesus christ', 'new testament', 'christian', 'christian faith', 'biblical', 'history', 'christ']",en,"A.D. The Bible Continues drama ""A.D. The Bible Continues"" picks up where the smash hit miniseries ""The Bible"" left off, continuing the greatest story ever told and exploring the exciting and inspiring events that followed the Crucifixion of Christ. The immediate aftermath of Christ's death had a massive impact on his disciples, his mother, Mary, and key political and religious leaders of the era, completely altering the entire world in an instant. Beginning at that fateful moment of the Crucifixion and the Resurrection, ""A.D. The Bible Continues"" will focus on the disciples who had to go forward and spread the teachings of Christ to a world dominated by political unrest, and the start of a whole new religion that would dramatically reshape the history of the world. crucifixion bible religion miniseries jesus christ new testament christian christian faith biblical history christ"
/h4Z2gdoQj0yLVvFsxAJsbIREGEA.jpg,/xvwcRQiE7aanggwKgwj9T3x4pdt.jpg,[18],"[5215, 4637, 10093, 11001, 18393, 18396, 157008, 208370, 208504]",71705,Broken,"Father Michael, a Catholic priest presiding over a Northern urban parish, who is modern, maverick, and reassuringly flawed, must be confidante, counselor and confessor to a congregation struggling to reconcile its beliefs with the challenges of daily life.",25.141,2017-05-30,6.9,32,['drama'],"['northern england', 'parish', 'priest', 'religion', 'congregation', 'catholic', 'catholic church', 'traumatic childhood', 'confidant']",en,"Broken drama Father Michael, a Catholic priest presiding over a Northern urban parish, who is modern, maverick, and reassuringly flawed, must be confidante, counselor and confessor to a congregation struggling to reconcile its beliefs with the challenges of daily life. northern england parish priest religion congregation catholic catholic church traumatic childhood confidant"
/htYZyyux80Qa5VQ7JraNYe3xaPh.jpg,/tYoh3YfEkyqQbHZ8sRtJDMPELpx.jpg,[99],"[2337, 516, 739, 6158, 6337, 5521, 5707, 6443, 6218, 10303, 11937, 12399, 12400, 14576, 15302]",226751,Shiny Happy People: Duggar Family Secrets,"A limited docuseries exposing the truth beneath the wholesome Americana surface of reality tv’s favorite mega-family, The Duggars, and the radical organization behind them: The Institute in Basic Life Principles. As details of the family and their scandals unfold, we realize they’re part of an insidious, much larger threat already in motion, with democracy itself in peril.",24.371,2023-06-01,7.3,15,['documentary'],"['pedophilia', 'child abuse', 'sexual abuse', 'cult', 'patriarchy', 'arkansas', 'childhood trauma', 'child pornography', 'right wing extremism', 'domestic abuse', 'conservative', 'homeschooling', 'brainwashing', 'pedophile', 'evangelical christianity']",en,"Shiny Happy People: Duggar Family Secrets documentary A limited docuseries exposing the truth beneath the wholesome Americana surface of reality tv’s favorite mega-family, The Duggars, and the radical organization behind them: The Institute in Basic Life Principles. As details of the family and their scandals unfold, we realize they’re part of an insidious, much larger threat already in motion, with democracy itself in peril. pedophilia child abuse sexual abuse cult patriarchy arkansas childhood trauma child pornography right wing extremism domestic abuse conservative homeschooling brainwashing pedophile evangelical christianity"
/miA0bK3vRgckl08zGaC3VGccC3E.jpg,/96D7gab3CxKH65oeVNIzJtnKOOj.jpg,[18],"[128, 3036, 9840, 11162, 11157, 18035, 243959, 268806]",69465,Cain and Abel,"Takada Yu is an employee of a development firm. His father has favored his high-achieving older brother and been indifferent to Yu since young. So Yu craves for his father’s love and wants his recognition somehow. Then one day, Yu encounters a woman. Although it was the worst possible meeting, he gradually starts to have romantic feelings for her through work and an unexpected development. But ironically enough, she turns out to be the girlfriend of his older brother. Yu begins to realize what he truly treasures and matures as a person as he struggles with this complicated romance and with his older brother and father.",23.015,2016-10-17,0.0,0,['drama'],"['love triangle', 'bible', 'romance', 'miniseries', 'sibling rivalry', 'family', 'brother brother relationship', 'office worker']",ja,"Cain and Abel drama Takada Yu is an employee of a development firm. His father has favored his high-achieving older brother and been indifferent to Yu since young. So Yu craves for his father’s love and wants his recognition somehow. Then one day, Yu encounters a woman. Although it was the worst possible meeting, he gradually starts to have romantic feelings for her through work and an unexpected development. But ironically enough, she turns out to be the girlfriend of his older brother. Yu begins to realize what he truly treasures and matures as a person as he struggles with this complicated romance and with his older brother and father. love triangle bible romance miniseries sibling rivalry family brother brother relationship office worker"
/8mzzDMoyP7JycYwundjZoj6O06Z.jpg,/c19j3MWj8S8UpIZSibJMp0pAewm.jpg,"[18, 10751]","[3036, 11162, 207089, 207317]",34647,The Nativity,"Drama revealing the human story beneath the classic biblical tale, from the courtship of Mary and Joseph in Nazareth to the birth of Jesus in a Bethlehem stable.",22.707,2010-12-20,8.8,5,"['drama', 'family']","['bible', 'miniseries', 'nativity', 'christmas']",en,"The Nativity drama family Drama revealing the human story beneath the classic biblical tale, from the courtship of Mary and Joseph in Nazareth to the birth of Jesus in a Bethlehem stable. bible miniseries nativity christmas"
/lAVXFxcAbz2O1TinM8rLrKAnHnQ.jpg,/3xJLEhpVEN7aLsqJchbhzGOpRLv.jpg,[10765],"[2343, 186, 5049, 170362, 177912, 192772, 213096, 241580, 271054]",4935,Roar,"Roar is an American television show that originally aired on the Fox network in July 1997. In the year AD 400, a young Irish man, Conor, sets out to rid his land of the invading Romans, but in order to accomplish this, he must unite the Celtic clans.",20.1,1997-07-14,6.7,13,['sci-fi & fantasy'],"['magic', 'christianity', 'ancient rome', 'fantasy world', 'wizard', 'historical drama', '5th century', 'mysticism', 'celtic mythology']",en,"Roar sci-fi & fantasy Roar is an American television show that originally aired on the Fox network in July 1997. In the year AD 400, a young Irish man, Conor, sets out to rid his land of the invading Romans, but in order to accomplish this, he must unite the Celtic clans. magic christianity ancient rome fantasy world wizard historical drama 5th century mysticism celtic mythology"
/zjemCbQkKaN6m8lCVgDIvxEDyDi.jpg,/6Ch7XQyOqMRt3KQEuUZ9OcKiMCt.jpg,"[16, 10762, 10751]","[186, 3036, 10706, 262743, 262745]",99899,The VeggieTales Show,"Bob, Larry and all your Veggie friends return in an all new television series. Bob and Larry use Mr.Nezzer's theatre to put on various performances based on stories from the Bible.",20.084,2019-10-15,10.0,1,"['animation', 'kids', 'family']","['christianity', 'bible', 'spirituality', 'the veggietales show', 'new veggietales']",en,"The VeggieTales Show animation kids family Bob, Larry and all your Veggie friends return in an all new television series. Bob and Larry use Mr.Nezzer's theatre to put on various performances based on stories from the Bible. christianity bible spirituality the veggietales show new veggietales"
/ge3Jm0cNK9SAJwId4Auf27oahLM.jpg,/mVozArOpfessXDPMwA3Q7pBsPmH.jpg,"[35, 16, 10762]","[3036, 6401, 11001, 206315, 220696]",5024,VeggieTales,"American series of children's computer animated films featuring anthropomorphic vegetables in stories conveying moral themes based on Christianity. They frequently retell Biblical stories, sometimes anachronistically reframed, and include humorous references to pop culture in many different eras by putting Veggie spins on them.",19.784,1993-12-21,7.5,17,"['comedy', 'animation', 'kids']","['bible', 'vegetable', 'religion', 'christanity', 'cartoon food']",en,"VeggieTales comedy animation kids American series of children's computer animated films featuring anthropomorphic vegetables in stories conveying moral themes based on Christianity. They frequently retell Biblical stories, sometimes anachronistically reframed, and include humorous references to pop culture in many different eras by putting Veggie spins on them. bible vegetable religion christanity cartoon food"
/qqGvJWr3aLl8BuTDga5fmzEAjc4.jpg,/c8xrpIZoti2iaUJmYBc37hRJCcd.jpg,"[16, 35]","[186, 1253, 5722, 9755, 9914, 173529, 195668, 206834, 210024, 230097, 247346]",102500,Saint☆Young Men,"Jesus Christ and Gautama Buddha, the founders of Christianity and Buddhism, are living together as roommates in a Tokyo apartment while taking a vacation on Earth. The comedy often involves jokes about Christianity, Buddhism, and all things related, as well as the main characters' attempts to hide their identities and understand modern society in Japan.

This is a 2 episode OVA preceding the movie of the same name.",19.679,2012-12-03,8.0,10,"['animation', 'comedy']","['christianity', 'roommate', 'buddha', 'parody', 'slice of life', 'apartment house', 'seinen', 'mischievous children', 'anime', 'jesus christ', 'buddha statue']",ja,"Saint☆Young Men animation comedy Jesus Christ and Gautama Buddha, the founders of Christianity and Buddhism, are living together as roommates in a Tokyo apartment while taking a vacation on Earth. The comedy often involves jokes about Christianity, Buddhism, and all things related, as well as the main characters' attempts to hide their identities and understand modern society in Japan.

This is a 2 episode OVA preceding the movie of the same name. christianity roommate buddha parody slice of life apartment house seinen mischievous children anime jesus christ buddha statue"
/jNmHcPQ3rK1oftbltbaUOgGgnV1.jpg,/1Nofyi3s5uNoEjGk67c89wqvjdd.jpg,[18],"[818, 392, 186, 1228, 10235, 10683, 158718, 163037, 187056, 211206, 228163]",1669,Oranges Are Not the Only Fruit,Seven-year-old Jess is removed from her peculiar Pentecostal home and sent to school.,19.358,1990-01-10,6.7,15,['drama'],"['based on novel or book', 'england', 'christianity', '1970s', 'family relationships', 'coming of age', 'lgbt', 'lgbt teen', 'woman director', 'pentecostalism', 'adopted daughter']",en,Oranges Are Not the Only Fruit drama Seven-year-old Jess is removed from her peculiar Pentecostal home and sent to school. based on novel or book england christianity 1970s family relationships coming of age lgbt lgbt teen woman director pentecostalism adopted daughter
