backdrop_path,poster_path,genre_ids,keyword_ids,id,title,overview,popularity,release_date,vote_average,vote_count,genres,keywords,original_language,soup
/mvmOcBT0WhyRmSpkhhBgdtp7GSL.jpg,/1ibIjP6puA4y2SfCn9icSehHrBu.jpg,"[10765, 35, 18]","[818, 530, 290, 8685, 10150, 12654, 15001, 158718, 177894, 209570, 230861, 266959]",71915,Good Omens,"Aziraphale, an angel, and Crowley, a demon, join forces to find the Antichrist and stop Armageddon.",259.953,2019-05-31,8.1,1731,"['sci-fi & fantasy', 'comedy', 'drama']","['based on novel or book', 'prophecy', 'angel', 'anti-christ', 'end of the world', 'armageddon', 'demon', 'lgbt', 'witch hunt', 'end of times', 'four horsemen of the apocalypse', 'lgbt interest']",en,"Good Omens sci-fi & fantasy comedy drama Aziraphale, an angel, and Crowley, a demon, join forces to find the Antichrist and stop Armageddon. based on novel or book prophecy angel anti-christ end of the world armageddon demon lgbt witch hunt end of times four horsemen of the apocalypse lgbt interest"
/jltxLKZCTmXDpVBBJn3o3txFcfX.jpg,/jiSv0xNx6MGhAFfv05Ov7DgDELJ.jpg,"[10765, 18, 10751]","[6054, 290, 6150, 3929, 10706, 11001, 170365, 229608]",2243,Touched by an Angel,"Monica, an angel, is tasked with bringing guidance and messages from God to various people who are at a crossroads in their lives.",222.114,1994-09-21,7.4,158,"['sci-fi & fantasy', 'drama', 'family']","['friendship', 'angel', 'faith', 'hope', 'spirituality', 'religion', 'good deed', 'encouragement']",en,"Touched by an Angel sci-fi & fantasy drama family Monica, an angel, is tasked with bringing guidance and messages from God to various people who are at a crossroads in their lives. friendship angel faith hope spirituality religion good deed encouragement"
/qaBwj91q7bx21y4xFAAYHR7wrDL.jpg,/qAuKjGNbcwdhbpxSciak8BFjQ5F.jpg,"[18, 80]","[531, 4562, 1499, 6593, 3688, 11925, 158718, 195624, 207981]",87017,P-Valley,"Down deep in the Mississippi Delta, Trap music meets film noir in this kaleidoscopic story of a little-strip-club-that-could and the big characters who come through its doors—the hopeful, the lost, the broken, the ballers, the beautiful, and the damned.",219.437,2020-07-12,7.8,204,"['drama', 'crime']","['southern usa', 'rapper', 'pastor', 'stripper', 'strip club', 'domestic violence', 'lgbt', 'black lgbt', 'south']",en,"P-Valley drama crime Down deep in the Mississippi Delta, Trap music meets film noir in this kaleidoscopic story of a little-strip-club-that-could and the big characters who come through its doors—the hopeful, the lost, the broken, the ballers, the beautiful, and the damned. southern usa rapper pastor stripper strip club domestic violence lgbt black lgbt south"
/qvbFdPvXMliwwrWlfUStcHc96JQ.jpg,/2pnZWHg9E34LLwLBLYUPLdZwer8.jpg,"[18, 10751, 10765]","[186, 3036, 230097, 273060, 282071, 309558]",85077,The Chosen,The life of Christ through the eyes of those who encountered him called The Chosen.,205.728,2019-04-21,8.6,131,"['drama', 'family', 'sci-fi & fantasy']","['christianity', 'bible', 'jesus christ', 'christian faith', 'biblical', 'os escolhidos']",en,The Chosen drama family sci-fi & fantasy The life of Christ through the eyes of those who encountered him called The Chosen. christianity bible jesus christ christian faith biblical os escolhidos
/mVMkUs47GUjoh2hYLNu2r30zJqM.jpg,/s6mkZKanKim3VGUIxR2gGGf9jn0.jpg,"[10751, 18]","[186, 4498, 10235, 11001, 12279, 14765]",4550,7th Heaven,"Reverend Eric Camden and his wife Annie have always had their hands full caring for seven children, not to mention the friends, sweethearts and spouses that continually come and go in the Camden household.",152.002,1996-08-26,6.5,176,"['family', 'drama']","['christianity', 'big family', 'family relationships', 'religion', 'family drama', 'church']",en,"7th Heaven family drama Reverend Eric Camden and his wife Annie have always had their hands full caring for seven children, not to mention the friends, sweethearts and spouses that continually come and go in the Camden household. christianity big family family relationships religion family drama church"
/rVHIT8zK129LohS5OGhwBYWfrdO.jpg,/kxasURRX1FHh1el6XYpSM2LGSVR.jpg,"[10765, 18]","[6150, 11436, 15167, 34004, 160342, 184559, 240835]",9899,Saving Grace,"Grace Hanadarko is a tormented, fast-living Oklahoma City police detective who, despite having an excellent career in solving crimes, takes self-destruction to new heights. After seeing tremendous tragedy, both professionally and personally, Grace reaches a turning point one night and meets a rough-hewn angel with a similar past who wants to help lead her back to the right path.",132.902,2007-07-23,8.2,40,"['sci-fi & fantasy', 'drama']","['faith', 'redemption', 'police detective', 'second chance', 'female detective', 'guardian angel', 'oklahoma city']",en,"Saving Grace sci-fi & fantasy drama Grace Hanadarko is a tormented, fast-living Oklahoma City police detective who, despite having an excellent career in solving crimes, takes self-destruction to new heights. After seeing tremendous tragedy, both professionally and personally, Grace reaches a turning point one night and meets a rough-hewn angel with a similar past who wants to help lead her back to the right path. faith redemption police detective second chance female detective guardian angel oklahoma city"
/6u4cUJVUcpQmW8FyKcJN6svCxSa.jpg,/ey1WQajA25E5sFGHSApcqSWUSEc.jpg,"[10765, 9648, 18]","[3133, 1556, 6152, 9717, 9649, 15001, 18072, 251513]",64230,Preacher,"A preacher sets out on a mission to make the almighty himself confess his sin of abandoning the world. With his best friend Cassidy, an alcoholic Irish vampire, his love Tulip, a red blooded gun towing Texan, and the power of genesis, an unholy child born from an angel and a devil, Jesse gives up everything to set the world straight with its creator.",127.453,2016-05-22,7.5,1018,"['sci-fi & fantasy', 'mystery', 'drama']","['vampire', 'texas', 'supernatural', 'based on comic', 'god', 'demon', 'preacher', 'supernatural power']",en,"Preacher sci-fi & fantasy mystery drama A preacher sets out on a mission to make the almighty himself confess his sin of abandoning the world. With his best friend Cassidy, an alcoholic Irish vampire, his love Tulip, a red blooded gun towing Texan, and the power of genesis, an unholy child born from an angel and a devil, Jesse gives up everything to set the world straight with its creator. vampire texas supernatural based on comic god demon preacher supernatural power"
/6HerLaK4Mjjtssma4fF3qQUixX5.jpg,/wdSi1q7WNLNvxvmjrI4F93zzqQO.jpg,"[10759, 16, 9648, 10765]","[212, 6149, 3133, 186, 1370, 2095, 6152, 3271, 10292, 9259, 11001, 12371, 12377, 13141, 163558]",16830,Hellsing,"Vampires exist. It is the duty of Hellsing, an organization sponsored by the British government, to hide that frightening fact and protect the blissfully unaware populace. Along with its own personal army, Hellsing also has a few secret weapons. Alucard, an incredibly powerful vampire, has been controlled by Hellsing for years. Although he dislikes being a servant to the Hellsing family, he certainly enjoys his job as Hellsing’s vampire exterminator. Seras is a fledgling vampire and a former police woman. Although reluctant to embrace her new self, she is still a valuable member of the organization. Integra Hellsing, the current leader, is usually fully capable of fulfilling her duty, but lately, vampire activity has been on the rise. Unfortunately, the cause is more alarming than anything she could have imagined...",120.94,2001-10-10,8.0,442,"['action & adventure', 'animation', 'mystery', 'sci-fi & fantasy']","['london, england', 'police', 'vampire', 'christianity', 'shapeshifting', 'anti hero', 'supernatural', 'secret organization', 'gore', 'vampire hunter (slayer)', 'religion', 'gunfight', 'zombie', 'based on manga', 'extrasensory perception']",ja,"Hellsing action & adventure animation mystery sci-fi & fantasy Vampires exist. It is the duty of Hellsing, an organization sponsored by the British government, to hide that frightening fact and protect the blissfully unaware populace. Along with its own personal army, Hellsing also has a few secret weapons. Alucard, an incredibly powerful vampire, has been controlled by Hellsing for years. Although he dislikes being a servant to the Hellsing family, he certainly enjoys his job as Hellsing’s vampire exterminator. Seras is a fledgling vampire and a former police woman. Although reluctant to embrace her new self, she is still a valuable member of the organization. Integra Hellsing, the current leader, is usually fully capable of fulfilling her duty, but lately, vampire activity has been on the rise. Unfortunately, the cause is more alarming than anything she could have imagined... london, england police vampire christianity shapeshifting anti hero supernatural secret organization gore vampire hunter (slayer) religion gunfight zombie based on manga extrasensory perception"
/d1wj4WQ87tj7dLgXCKfPOe8AOz4.jpg,/dlGmVpZ2rpGRDZsSa64nzyu90xk.jpg,"[18, 10765]","[3648, 3570, 3571, 3033, 3034, 3036, 6987, 6506, 9031, 11001, 18126, 181212, 222185, 230097, 243261]",19649,Jesus of Nazareth,"Dramatizes the Birth, Life, Ministry, Crucifixion, and Resurrection of Jesus Christ, largely according to the Holy Bible's New Testament Gospels.",117.286,1977-03-27,7.8,429,"['drama', 'sci-fi & fantasy']","['archangel gabriel', 'three kings', 'crucifixion', 'apostle', 'last supper', 'bible', 'idealism', 'resurrection', 'idealist', 'religion', 'sermon on the mount', 'son of god', '1st century', 'jesus christ', 'new testament']",en,"Jesus of Nazareth drama sci-fi & fantasy Dramatizes the Birth, Life, Ministry, Crucifixion, and Resurrection of Jesus Christ, largely according to the Holy Bible's New Testament Gospels. archangel gabriel three kings crucifixion apostle last supper bible idealism resurrection idealist religion sermon on the mount son of god 1st century jesus christ new testament"
/wu444tM9YBllq9UcBv5TeidO3j3.jpg,/37p95Lpe7mfVX86ZcVr7TisAHPn.jpg,"[10765, 18, 9648]","[10150, 179101, 188351, 215659, 263706, 269233]",91557,Ragnarok,A small Norwegian town experiencing warm winters and violent downpours seems to be headed for another Ragnarök -- unless someone intervenes in time.,110.334,2020-01-31,7.9,926,"['sci-fi & fantasy', 'drama', 'mystery']","['end of the world', 'norse mythology', 'catastrophe', 'salvation', 'norwegian folklore', 'good versus evil']",no,Ragnarok sci-fi & fantasy drama mystery A small Norwegian town experiencing warm winters and violent downpours seems to be headed for another Ragnarök -- unless someone intervenes in time. end of the world norse mythology catastrophe salvation norwegian folklore good versus evil
/mz5L2zlZuMlQwVE8Yxvb2YK1wsl.jpg,/evZtiZzMX9VFoM1zzvRUmPoLPBg.jpg,"[16, 18, 10765]","[212, 2652, 6149, 3133, 186, 1370, 2095, 6152, 3271, 10292, 9259, 9714, 11001, 12371, 12377]",61752,Hellsing Ultimate,"For over a century, the mysterious Hellsing Organization has been secretly protecting the British Empire from the undead. When Sir Integra Hellsing succeeded as the head of the organization, she also inherited the ultimate weapon against these supernatural enemies: Alucard, a rogue vampire possessing mysterious and frightening powers. Now, Hellsing must deal with a more dangerous threat than vampires.",96.795,2006-02-10,8.5,536,"['animation', 'drama', 'sci-fi & fantasy']","['london, england', 'nazi', 'police', 'vampire', 'christianity', 'shapeshifting', 'anti hero', 'supernatural', 'secret organization', 'gore', 'vampire hunter (slayer)', 'remake', 'religion', 'gunfight', 'zombie']",ja,"Hellsing Ultimate animation drama sci-fi & fantasy For over a century, the mysterious Hellsing Organization has been secretly protecting the British Empire from the undead. When Sir Integra Hellsing succeeded as the head of the organization, she also inherited the ultimate weapon against these supernatural enemies: Alucard, a rogue vampire possessing mysterious and frightening powers. Now, Hellsing must deal with a more dangerous threat than vampires. london, england nazi police vampire christianity shapeshifting anti hero supernatural secret organization gore vampire hunter (slayer) remake religion gunfight zombie"
/d6OdX943Igjy3RItNhlPjKtpHw8.jpg,/952uUaNc6zJbb0rXSwFPskp2SKY.jpg,[18],"[818, 392, 4152, 345, 2638, 9920, 11001, 11162, 15060, 15126, 41282, 41406, 157008, 159862, 161257]",33234,The Pillars of the Earth,"A sweeping epic of good and evil, treachery and intrigue, violence and beauty, a sensuous, spirited story set against a backdrop of war, religious strife and power struggles in 12th Century England.",87.989,2010-07-23,7.7,314,['drama'],"['based on novel or book', 'england', 'kingdom', 'monk', 'cathedral', 'royalty', 'religion', 'miniseries', 'period drama', 'historical', 'political intrigue\xa0', 'middle ages', 'catholic church', 'british history', 'medieval']",en,"The Pillars of the Earth drama A sweeping epic of good and evil, treachery and intrigue, violence and beauty, a sensuous, spirited story set against a backdrop of war, religious strife and power struggles in 12th Century England. based on novel or book england kingdom monk cathedral royalty religion miniseries period drama historical political intrigue  middle ages catholic church british history medieval"
/A4kINEPmKCUsTCUtdxCLZkPD0gl.jpg,/v2DDGnv9kElP7ECd4j6jsLxEDSb.jpg,"[18, 16, 10765, 10759, 35]","[242, 186, 1370, 6152, 9840, 10614, 11001, 12371, 13141, 15001, 15126, 159940, 190142, 207826, 210024]",34061,Chrono Crusade,"Set in New York during the 1920s, Chrono Crusade follows the story of Rosette Christopher, and her demon partner Chrono. As members of the Magdalene Order, they travel around the country eliminating demonic threats to society, while Rosette searches for her lost brother Joshua.",69.67,2003-11-25,8.1,71,"['drama', 'animation', 'sci-fi & fantasy', 'action & adventure', 'comedy']","['new york city', 'christianity', 'shapeshifting', 'supernatural', 'romance', 'tragedy', 'religion', 'gunfight', 'based on manga', 'demon', 'historical', 'exorcist', 'angst', 'shounen', 'anime']",ja,"Chrono Crusade drama animation sci-fi & fantasy action & adventure comedy Set in New York during the 1920s, Chrono Crusade follows the story of Rosette Christopher, and her demon partner Chrono. As members of the Magdalene Order, they travel around the country eliminating demonic threats to society, while Rosette searches for her lost brother Joshua. new york city christianity shapeshifting supernatural romance tragedy religion gunfight based on manga demon historical exorcist angst shounen anime"
/fU01Xckb1U4y0Zl4d7a8teICMbp.jpg,/2iTD2UYRloK8H5djnlliYATZQUA.jpg,[18],"[716, 717, 3170, 9649, 10410, 11001, 157008]",62699,The Young Pope,"Lenny Belardo, the youngest and first American Pope in the history of the Church, must establish his new papacy and navigate the power struggles of the closed, secretive Vatican.",69.241,2016-10-21,7.7,464,['drama'],"['vatican', 'pope', 'cigarette', 'god', 'conspiracy', 'religion', 'catholic church']",it,"The Young Pope drama Lenny Belardo, the youngest and first American Pope in the history of the Church, must establish his new papacy and navigate the power struggles of the closed, secretive Vatican. vatican pope cigarette god conspiracy religion catholic church"
/jMxwjnzjnTZz3ku6nJWvjg0T2nd.jpg,/se3MZ1OVfIrZqFJkpm3kVnpkKpO.jpg,[18],"[6150, 6158, 11001, 40865]",65227,The Path,"The Path explores the unknown and mysterious world of the cult-like Meyerist Movement in upstate New York. At the center of the movement lies Eddie, a conflicted husband; Sarah, his devoted wife; and Cal, an ambitious leader. We follow each as they contend with deep issues involving relationships, faith, and power.",67.812,2016-03-30,6.6,121,['drama'],"['faith', 'cult', 'religion', 'new york state']",en,"The Path drama The Path explores the unknown and mysterious world of the cult-like Meyerist Movement in upstate New York. At the center of the movement lies Eddie, a conflicted husband; Sarah, his devoted wife; and Cal, an ambitious leader. We follow each as they contend with deep issues involving relationships, faith, and power. faith cult religion new york state"
/veLDNOr8omsQN6hX3HWgq5PVD1P.jpg,/dFwBvUhtV8ynSLaSXfRUYInlTFk.jpg,"[16, 18]","[6270, 6054, 1416, 186, 5783, 9840, 10683, 9914, 10614, 10048, 10873, 12648, 13141, 190142, 201057]",42557,Kids on the Slope,Two different students - a successful but aloof academic and a rebellious but kindhearted delinquent - form a friendship through their love for music.,65.925,2012-04-13,7.8,51,"['animation', 'drama']","['high school', 'friendship', 'jazz', 'christianity', 'classical music', 'romance', 'coming of age', 'slice of life', 'tragedy', 'unrequited love', 'school', 'bromance', 'based on manga', 'angst', 'transfer student']",ja,Kids on the Slope animation drama Two different students - a successful but aloof academic and a rebellious but kindhearted delinquent - form a friendship through their love for music. high school friendship jazz christianity classical music romance coming of age slice of life tragedy unrequited love school bromance based on manga angst transfer student
/2rzV87fCcVS7En9fFpoEbgfqDhU.jpg,/urF7woedo1sgDy7bD5Y1yo0c4Gd.jpg,"[16, 35]","[186, 9727, 210024]",13452,Saint Tail,"Saint Tail is a phantom thief magical girl manga and anime series. Originally a twenty-four part manga by Megumi Tachikawa, the story was adapted into an anime television series by producer Tokyo Movie Shinsha, with forty-three episodes and one short, broadcast by ABC. Tokyopop translated the manga series, and subtitled and partially dubbed the anime series.

Video Games were released for the Sega Saturn and Sega Game Gear in Japan, and are considered collectors items by Saint Tail fans.

The Tokyopop book summary states that it is ""Robin Hood meets Sailor Moon!""",65.696,1995-10-12,6.5,4,"['animation', 'comedy']","['christianity', 'thief', 'anime']",ja,"Saint Tail animation comedy Saint Tail is a phantom thief magical girl manga and anime series. Originally a twenty-four part manga by Megumi Tachikawa, the story was adapted into an anime television series by producer Tokyo Movie Shinsha, with forty-three episodes and one short, broadcast by ABC. Tokyopop translated the manga series, and subtitled and partially dubbed the anime series.

Video Games were released for the Sega Saturn and Sega Game Gear in Japan, and are considered collectors items by Saint Tail fans.

The Tokyopop book summary states that it is ""Robin Hood meets Sailor Moon!"" christianity thief anime"
/o15mg5xbGkSPfW4e8ES42WzpZAy.jpg,/leaPXZKi7OBKfLUwyoGu5bP5WU2.jpg,"[80, 18, 9648]","[745, 157008, 157241, 158431, 208992, 262371]",157282,Sister Boniface Mysteries,"First there was Father Brown. Now, say hello to Sister Boniface. This clever, moped-riding nun is the police's secret weapon for solving murders in this divine Father Brown spin-off.",64.229,2022-02-08,6.2,20,"['crime', 'drama', 'mystery']","['nun', 'catholic church', 'criminal investigation', 'united kingdom', '1960s', 'police drama']",en,"Sister Boniface Mysteries crime drama mystery First there was Father Brown. Now, say hello to Sister Boniface. This clever, moped-riding nun is the police's secret weapon for solving murders in this divine Father Brown spin-off. nun catholic church criminal investigation united kingdom 1960s police drama"
/dqXMlEw678SEHcB8sagjybt9mpW.jpg,/hlBkKc9JGPszx9FjLnARad9yQA3.jpg,[18],"[1960, 3691, 9840, 10093, 11162, 14720, 157008, 161207, 172391, 208261, 209803]",13780,The Thorn Birds,The story based on a novel by Colleen McCullough focuses on three generations of the Cleary family living on a sheep station in the Australian outback.,63.097,1983-03-27,7.2,103,['drama'],"['mine', 'forbidden love', 'romance', 'priest', 'miniseries', 'love affair', 'catholic church', 'catholicism', 'catholic priest', 'vow of celibacy', 'family saga']",en,The Thorn Birds drama The story based on a novel by Colleen McCullough focuses on three generations of the Cleary family living on a sheep station in the Australian outback. mine forbidden love romance priest miniseries love affair catholic church catholicism catholic priest vow of celibacy family saga
/sC7DcOOWmQ2WNEVDjLY0t8rEwqS.jpg,/uSrIXnPIUkapk0JwMldDZTusl5O.jpg,"[16, 18, 9648, 10765]","[236, 233, 1453, 548, 6155, 290, 11436, 9914, 10614, 156597, 190142, 194421, 195668, 200715, 210024]",34164,Haibane Renmei,"A dream of falling from the sky...and then birth. Rakka is born from a large cocoon into the Old Home, greeted by a group of females with small wings on their backs and shining halos above their heads. Soon Rakka’s own wings grow, a halo is placed on her head and she is told that she must work in the nearby town of Grie. She soon realizes that the town and the entire world they live in are confined behind the Wall, a tall, impenetrable wall that none except the mysterious Toga are allowed to exit.",54.365,2002-10-09,7.9,78,"['animation', 'drama', 'mystery', 'sci-fi & fantasy']","['suicide', 'japan', 'amnesia', 'countryside', 'afterlife', 'angel', 'redemption', 'slice of life', 'tragedy', 'magic realism', 'angst', 'rebirth', 'seinen', 'feather', 'anime']",ja,"Haibane Renmei animation drama mystery sci-fi & fantasy A dream of falling from the sky...and then birth. Rakka is born from a large cocoon into the Old Home, greeted by a group of females with small wings on their backs and shining halos above their heads. Soon Rakka’s own wings grow, a halo is placed on her head and she is told that she must work in the nearby town of Grie. She soon realizes that the town and the entire world they live in are confined behind the Wall, a tall, impenetrable wall that none except the mysterious Toga are allowed to exit. suicide japan amnesia countryside afterlife angel redemption slice of life tragedy magic realism angst rebirth seinen feather anime"
/lxRw1nP3stI1kBvn2D17MpYND0M.jpg,/l6wvwTlF9hlZ6Yg5dqBYTtmzYkb.jpg,"[18, 10765]","[530, 1003, 3099, 4747, 8685, 11001, 14999, 156075, 161207, 165317]",19033,Damien,"After discovering his origins, Damien Thorn must cope with life as the Anti-Christ.",53.071,2016-03-07,6.3,112,"['drama', 'sci-fi & fantasy']","['prophecy', 'photographer', 'satanism', 'war photographer', 'anti-christ', 'religion', 'devil', 'evil', 'catholicism', 'based on movie']",en,"Damien drama sci-fi & fantasy After discovering his origins, Damien Thorn must cope with life as the Anti-Christ. prophecy photographer satanism war photographer anti-christ religion devil evil catholicism based on movie"
/74WnSUq61RkNtpbIG5nBcNpsJQe.jpg,/4TFkZz3nsbnPSOOekrbT7S04PRV.jpg,"[35, 18]","[1499, 8631, 10199, 10093, 11062, 13068, 155751, 249749, 258533]",62263,Impastor,"Buddy Dobbs, a slacker on the run from a loan shark, steals a man's identity and ends up posing as a small town's new gay pastor.",52.588,2015-07-15,7.2,52,"['comedy', 'drama']","['pastor', 'slacker', 'gay interest', 'priest', 'impersonator', 'impostor', 'stolen identity', 'pretending to be gay', 'gay theme']",en,"Impastor comedy drama Buddy Dobbs, a slacker on the run from a loan shark, steals a man's identity and ends up posing as a small town's new gay pastor. pastor slacker gay interest priest impersonator impostor stolen identity pretending to be gay gay theme"
/A7pq4B0uCPCLvk1EPFKQgJZQoVG.jpg,/2lyFPOe6JScMBiLQuMtf3pPZxAu.jpg,"[16, 35]","[10138, 8685, 10809, 15001, 161919]",125392,Little Demon,"13 years after being impregnated by Satan, a reluctant mother, Laura, and her Antichrist daughter, Chrissy, attempt to live an ordinary life in Delaware, but are constantly thwarted by monstrous forces, including Satan, who yearns for custody of his daughter's soul.",50.22,2022-08-25,7.8,64,"['animation', 'comedy']","['satan', 'anti-christ', 'teenage girl', 'demon', 'adult animation']",en,"Little Demon animation comedy 13 years after being impregnated by Satan, a reluctant mother, Laura, and her Antichrist daughter, Chrissy, attempt to live an ordinary life in Delaware, but are constantly thwarted by monstrous forces, including Satan, who yearns for custody of his daughter's soul. satan anti-christ teenage girl demon adult animation"
/z8U5TieGteOtukxxAvruqdeQNjh.jpg,/dZUfIrlXUXcptaTGNqy2jc5DGyA.jpg,"[35, 18]","[1415, 4480, 1842, 10093, 11001, 14985, 157008, 172391, 172684, 184230, 206545, 232529]",3734,Ballykissangel,"Ballykissangel is a BBC television drama set in Ireland, produced in-house by BBC Northern Ireland. The original story revolved around a young English Roman Catholic priest as he became part of a rural community. It ran for six series, which were first broadcast on BBC One in the United Kingdom from 1996 to 2001.",46.794,1996-02-11,6.9,8,"['comedy', 'drama']","['small town', 'businessman', 'village life', 'priest', 'religion', 'ireland', 'catholic church', 'catholic priest', 'agnostic', 'englishman abroad', 'young couple', 'irish life']",en,"Ballykissangel comedy drama Ballykissangel is a BBC television drama set in Ireland, produced in-house by BBC Northern Ireland. The original story revolved around a young English Roman Catholic priest as he became part of a rural community. It ran for six series, which were first broadcast on BBC One in the United Kingdom from 1996 to 2001. small town businessman village life priest religion ireland catholic church catholic priest agnostic englishman abroad young couple irish life"
